{"api_version":"1.0","generated_at":"2026-01-01T00:00:00Z","command":"dashboard","success":true,"data":{"toolkit_version":"1.20.4","observed_at":"2026-01-01T00:00:00Z","deployment":{"engine":"native","site":"erp.test","installation_profile":"recommended","reconciliation":"unknown"},"overall_status":"CRITICAL","resources":{"status":"DEGRADED","disk_used_percent":85,"inode_used_percent":5,"memory_available_percent":10,"memory_available_kb":1000,"memory_total_kb":10000,"swap_used_percent":0,"load_1m":null,"cpu_cores":4,"cpu_used_percent":null,"iowait_percent":null,"uptime_seconds":1000,"reboot_required":false},"application":{"status":"CRITICAL","http_status":"CRITICAL","http_code":null,"http_latency_ms":null,"database_status":"UNKNOWN","redis_status":"UNKNOWN","workers_status":"UNKNOWN","worker_count":null,"scheduler_status":"UNKNOWN","queue_status":"UNKNOWN","queue_depth":null},"runtime":{"status":"CRITICAL","docker_running":null,"docker_total":null,"docker_max_restarts":null},"protection":{"status":"DEGRADED","https_status":"UNKNOWN","certificate_days_remaining":null,"firewall_status":"DEGRADED","fail2ban_status":"UNKNOWN","integrity_status":"HEALTHY","backup":{"local_status":"CRITICAL","local_age_hours":null,"off_vm_status":"UNKNOWN","object_status":"UNKNOWN","restore_rehearsal_status":"CRITICAL"}},"healing":{"mode":"monitor","status":"observing","would_heal":null},"checks":{},"issues":["http_critical"]},"error":null}
