{"api_version":"1.0","generated_at":"2026-08-20T12:00:00Z","command":"backup-status","success":true,"data":{"toolkit_version":"1.20.4","observed_at":"2026-08-20T12:00:00Z","deployment":{"engine":"native","site":"erp.test"},"overall_status":"HEALTHY","local":{"status":"HEALTHY","storage_kind":"native-site-directory","scan_truncated":false,"total_observed_set_count":1,"complete_set_count":1,"latest_set":{"id":"aaaaaaaaaaaaaaaaaaaaaaaaaaaaaaaaaaaaaaaaaaaaaaaaaaaaaaaaaaaaaaaa","created_at":"2026-08-20T11:00:00Z","age_hours":1,"completeness":"complete","total_size_bytes":42,"components":{"database":{"present":true,"size_bytes":10},"public_files":{"present":true,"size_bytes":10},"private_files":{"present":true,"size_bytes":10},"site_configuration":{"present":true,"size_bytes":2},"checksum_manifest":{"present":true,"size_bytes":10}}}},"schedule":{"status":"HEALTHY","supported":true,"configured":true,"enabled":true,"active":true,"next_run_at":"2026-08-21T00:00:00Z"},"retention":{"status":"HEALTHY","configured_keep_count":14,"complete_set_count":1,"cleanup_candidate_count":0,"backup_filesystem_used_percent":20},"off_vm":{"status":"HEALTHY","configured":true,"last_result_status":"success","last_run_at":"2026-08-20T11:30:00Z"},"object_storage":{"status":"HEALTHY","configured":true,"last_result_status":"success","last_run_at":"2026-08-20T11:40:00Z"},"issues":[]},"error":null}
