{"api_version":"1.0","generated_at":"2026-08-20T12:00:00Z","command":"backup-status","success":true,"data":{"toolkit_version":"1.20.4","observed_at":"2026-08-20T12:00:00Z","deployment":{"engine":"native","site":"erp.test"},"overall_status":"CRITICAL","local":{"status":"CRITICAL","storage_kind":"native-site-directory","scan_truncated":false,"total_observed_set_count":null,"complete_set_count":null,"latest_set":null},"schedule":{"status":"UNKNOWN","supported":false,"configured":false,"enabled":null,"active":null,"next_run_at":null},"retention":{"status":"DEGRADED","configured_keep_count":14,"complete_set_count":null,"cleanup_candidate_count":null,"backup_filesystem_used_percent":null},"off_vm":{"status":"DEGRADED","configured":false,"last_result_status":"unknown","last_run_at":null},"object_storage":{"status":"DEGRADED","configured":false,"last_result_status":"unknown","last_run_at":null},"issues":["backup_directory_missing","backup_set_missing","object_storage_not_configured","off_vm_not_configured"]},"error":null}
