{"api_version":"1.0","generated_at":"2026-01-02T03:04:05Z","command":"deployment-info","success":true,"data":{"toolkit_version":"1.20.4","configuration":{"status":"managed","source":"primary","schema_version":"2"},"deployment":{"engine":"docker","engine_source":"explicit","installation_profile":"advanced","profile_source":"explicit","requested_applications":["crm","helpdesk"],"deployment_mode":"public-vm","runtime_mode":"production","docker_mode":"production","site_name":"erp.example.com","public_domain":"erp.example.com"},"observation":{"management_scope":"configuration-only","runtime_probed":false,"inventory_probed":false},"issues":[]},"error":null}
