{"api_version":"1.0","generated_at":"2026-08-20T12:00:00Z","command":"backup-status","success":true,"data":{"toolkit_version":"1.20.4","observed_at":"2026-08-20T12:00:00Z","deployment":{"engine":"native","site":"erp.test"},"overall_status":"DEGRADED","local":{"status":"DEGRADED","storage_kind":"native-site-directory","scan_truncated":false,"total_observed_set_count":1,"complete_set_count":0,"latest_set":{"id":"cccccccccccccccccccccccccccccccccccccccccccccccccccccccccccccccc","created_at":"2026-08-20T11:00:00Z","age_hours":1,"completeness":"partial","total_size_bytes":10,"components":{"database":{"present":true,"size_bytes":10},"public_files":{"present":false,"size_bytes":null},"private_files":{"present":false,"size_bytes":null},"site_configuration":{"present":false,"size_bytes":null},"checksum_manifest":{"present":false,"size_bytes":null}}}},"schedule":{"status":"DEGRADED","supported":true,"configured":true,"enabled":false,"active":false,"next_run_at":null},"retention":{"status":"DEGRADED","configured_keep_count":14,"complete_set_count":0,"cleanup_candidate_count":0,"backup_filesystem_used_percent":null},"off_vm":{"status":"CRITICAL","configured":true,"last_result_status":"failed","last_run_at":"2026-08-20T10:00:00Z"},"object_storage":{"status":"CRITICAL","configured":true,"last_result_status":"failed","last_run_at":"2026-08-20T10:00:00Z"},"issues":["backup_set_partial","object_storage_last_run_failed","off_vm_last_run_failed","schedule_disabled","schedule_inactive"]},"error":null}
