{"api_version":"1.0","generated_at":"2026-08-20T12:00:00Z","command":"restore-status","success":true,"data":{"toolkit_version":"1.20.4","observed_at":"2026-08-20T12:00:00Z","deployment":{"engine":"docker","site":"erp.test"},"overall_status":"DEGRADED","candidate":{"available":true,"id":"bbbbbbbbbbbbbbbbbbbbbbbbbbbbbbbbbbbbbbbbbbbbbbbbbbbbbbbbbbbbbbbb","created_at":"2026-08-20T11:00:00Z","age_hours":1,"completeness":"complete","database_available":true,"public_files_available":true,"private_files_available":true,"site_configuration_available":true,"checksum_manifest_present":true,"deep_verification_performed":false},"rehearsal":{"status":"UNKNOWN","recorded":false,"recorded_at":null,"successful":null,"site_matches":null,"candidate_matches":null,"login_validated":null},"readiness":{"database_restore_candidate":true,"full_restore_candidate":true,"matching_rehearsal_proven":false,"deep_integrity_verified":false,"live_restore_performed":false},"issues":["deep_verification_not_performed","object_storage_not_configured","off_vm_not_configured","rehearsal_missing"]},"error":null}
