{"api_version":"1.0","generated_at":"2026-01-01T00:00:00Z","command":"health-snapshot","success":true,"data":{"toolkit_version":"1.20.4","observed_at":"2026-01-01T00:00:00Z","deployment":{"engine":"docker","site":"erp.example.com","installation_profile":"recommended","reconciliation":"consistent"},"overall_status":"HEALTHY","resources":{"status":"HEALTHY","disk_used_percent":30,"inode_used_percent":5,"memory_available_percent":70,"memory_available_kb":7000,"memory_total_kb":10000,"swap_used_percent":0,"load_1m":0.5,"cpu_cores":4,"cpu_used_percent":10,"iowait_percent":1,"uptime_seconds":1000,"reboot_required":false},"application":{"status":"HEALTHY","http_status":"HEALTHY","http_code":200,"http_latency_ms":20,"database_status":"UNKNOWN","redis_status":"UNKNOWN","workers_status":"UNKNOWN","worker_count":null,"scheduler_status":"UNKNOWN","queue_status":"UNKNOWN","queue_depth":null},"runtime":{"status":"HEALTHY","docker_running":8,"docker_total":8,"docker_max_restarts":0},"protection":{"status":"HEALTHY","https_status":"HEALTHY","certificate_days_remaining":60,"firewall_status":"HEALTHY","fail2ban_status":"HEALTHY","integrity_status":"HEALTHY","backup":{"local_status":"HEALTHY","local_age_hours":2,"off_vm_status":"HEALTHY","object_status":"UNKNOWN","restore_rehearsal_status":"HEALTHY"}},"healing":{"mode":"monitor","status":"observing","would_heal":null},"checks":{},"issues":["database_unknown","redis_unknown"]},"error":null}
