{"api_version":"1.0","generated_at":"2026-01-01T00:00:00Z","command":"incidents","success":true,"data":{"toolkit_version":"1.20.4","limit":20,"count":1,"truncated":false,"incidents":[{"id":"20260101T000000Z-1","timestamp":"2026-01-01T00:00:00Z","previous_status":"HEALTHY","status":"DEGRADED","site":"erp.test","host_status":"HEALTHY","application_status":"DEGRADED","http_status":"HEALTHY","protection_status":"HEALTHY","would_heal":"none"}],"issues":[]},"error":null}
