{"api_version":"1.0","generated_at":"2026-01-02T03:04:05Z","command":"deployment-info","success":true,"data":{"toolkit_version":"1.20.4","configuration":{"status":"legacy-compatible","source":"legacy","schema_version":"legacy"},"deployment":{"engine":"native","engine_source":"legacy-default","installation_profile":"recommended","profile_source":"legacy-default","requested_applications":[],"deployment_mode":"development","runtime_mode":"dev","docker_mode":null,"site_name":"erp.test","public_domain":null},"observation":{"management_scope":"configuration-only","runtime_probed":false,"inventory_probed":false},"issues":["legacy_configuration"]},"error":null}
