{"api_version":"1.0","generated_at":"2026-01-02T03:04:05Z","command":"deployment-info","success":true,"data":{"toolkit_version":"1.20.4","configuration":{"status":"missing","source":null,"schema_version":null},"deployment":{"engine":null,"engine_source":null,"installation_profile":null,"profile_source":null,"requested_applications":[],"deployment_mode":null,"runtime_mode":null,"docker_mode":null,"site_name":null,"public_domain":null},"observation":{"management_scope":"none","runtime_probed":false,"inventory_probed":false},"issues":["configuration_missing"]},"error":null}
